{
  "control_point": "ready_for_dev",
  "workflow": "refinement",
  "team": "example-team",
  "current_level": "audit",
  "parameters": {
    "cadence": "weekly",
    "on_revoke": "re-refine and re-attempt ready packet"
  },
  "evidence": [
    {
      "source": "eval",
      "metric": "92% PM-marked-ready tickets accepted by developer over last 60 tickets",
      "window": "2026-02-01..2026-04-30",
      "detail": "evals/refinement/ready-acceptance.md"
    },
    {
      "source": "manual",
      "metric": "Team lead sign-off after retro on three contested bounce-backs",
      "window": "rationale-as-of 2026-05-01",
      "detail": "retros/2026-05-refinement-trust.md"
    }
  ],
  "granted_by": "team-lead@example.com",
  "granted_at": "2026-05-01",
  "expires_at": "2026-08-01",
  "review_cadence": "monthly",
  "revocation": {
    "procedure": "Any authorized revoker re-tightens to block via this file; no other team action required.",
    "authorized_revokers": ["team-lead@example.com", "pm-lead@example.com"]
  }
}
